id,Job_title,Salary_Range,Industry,Number_of_employees,listing_description,job_description
949532,Creative Producer,"Less than 300,000",IT & Telecoms,4,Timely and Consistent Delivery of Creatives: Ensure the regular and punctual delivery of a wide range of creative assets to internal stakeholders;,social discoveri group world largest group social discoveri compani unit 50 brand 20 year creat premium intern date servic social discoveri app focu video stream ai technolog entertain game mechan product portfolio includ date com cupid medium dil mil mani product alreadi use 500 million user 150 countri around world n n n nsdg invest social discoveri technolog startup around world invest includ open ai patreon flo wildli raw eva ai clubhous magnet tubit woebot bambam flure astri coursera academia harbour space auto1 docsend appanni rapyd boom superson trade view k health mani n nwe solv problem loneli isol disconnect help digit realiti n n n nour digit nomad team 800 profession work world intern team like mind peopl profession solv ambiti daili task creat truli global product valu focus result proactiv approach alway look new unconvent idea n nour team digit nomad live work remot cypru malta usa thailand indonesia hong kong australia poland israel rkiy latvia mani n nwe look creativ produc one invest product n n n nyour main task n ntime consist deliveri creativ ensur regular punctual deliveri wide rang creativ asset intern stakehold singl point contact creativ product serv primari liaison creativ product coordin task request overse end end creativ product process partnership sourc manag identifi engag new partner product compani creativ agenc negoti contract secur optim commerci term qualiti control time distribut maintain qualiti control standard ensur creativ asset deliv promptli meet requir competitor analysi trend research analyz mobil creativ market studi trend collabor build identifi creator establish long term collabor agreement content ideat script develop content idea script creator perform analysi evalu effect perform campaign launch use develop creativ new idea effici strategi formul creat new idea strategi enhanc depart effici product content qualiti creativ librari develop build optim function creativ librari share knowledg among market n nwe expect n n5 year work experi creativ field depth knowledg tiktok meta platform includ trend featur skill creat mobil focus creativ understand perform metric abil develop creativ concept write detail brief ad materi effect task deleg collabor product team stay updat social medium trend platform english profici effect commun negoti experi edit video select sourc footag music graphic etc n nwhat offer n nremot opportun work full time 7 well day per year time use deal household issu lie recov without take sick leav bonus 5000 recommend success applic posit compani full payment profession train intern confer meet corpor discount english lesson health benefit elig corpor medic insur compani compens 1000 gross per year per employe accord paycheck thi spent self purchas health insur doctor fee close rel spous child workplac organ compani provid employe equip workplac necessari equip tabl armchair wifi etc locat offic co work locat compani provid reimburs workplac cost 1000 gross onc everi 3 year accord paycheck thi money spent rent co work room equip work place home desk chair internet etc dure 3 year intern gamifi gratitud system receiv bonus colleagu exchang time merch team build activ massag certif etc 
949531,Suspicious Activity Investigator,"Less than 300,000",IT & Telecoms,4,We are seeking a SAR Investigator to support our compliance growth into all global frontiers and provide support on suspicious activity reviews to ensure we stay in continuous compliance with regulations and internal policy requirements.,binanc lead global blockchain ecosystem cryptocurr infrastructur provid whose suit financi product includ world largest digit asset exchang mission acceler cryptocurr adopt increas freedom money look fast pace mission driven organ opportun learn excel endless binanc place seek sar investig support complianc growth global frontier provid support suspici activ review ensur stay continu complianc regul intern polici requir n n n nrespons handl review assign case within avail sla includ advis relev stakehold next stepsmaintain escal log ensur escal team promptli review resolvedmaintain client board log support client board process requiredwher ground suspicion requir guidanc relat case escal accordingli team lead relev mlrospartn relev intern stakehold strengthen qualiti sar ensur consist accuracyprofici complianc applic programm chainalysi trm ellipt kodex refinitiv etc good knowledg provis local law direct regul otherwis standard applic subject person knowledg upcom regul virtual currenc polici strong plusparticip intern extern program relat aml cft subject may form part day day work requirementsani gener administr ancillari activ may requir relat abov function accord busi requir compani n nrequir bachelor degre busi legal relat field equival practic experience3 5 year experi investig includ file sar relat audit regulatori experi financi institut fintech company navig ambigu fast pace dynam environmentexcel attent detail abil action orient seek meet high standardsexcel written verbal commun time manag analyt investig skill n nwork binanc part world lead blockchain ecosystem continu grow offer excel career develop opportun work alongsid diver world class talent environ learn growth opportun endless tackl fast pace challeng uniqu project work truli global organ intern team flat organiz structur competit salari benefit balanc life work flexibl work hour casual work attirelearn binancian embodi organ core valu creat unifi cultur enabl collabor excel growth appli today part web3 revolut binanc commit equal opportun employ believ diver workforc fundament success 
949516,Customer Support Agent,"Less than 300,000",Healthcare,4,We are looking for customer-centric individuals to service our marketplace with empathy and judgment. You own your customer's issues and provide the best solutions and service by moving as fast as possible. You go out of your way to make sure the customer is taken care of.,whi clipboard health exist exist lift mani peopl socioeconom ladder possibl dramat improv live let healthcar profession turn extra time ambit career growth financi opportun achiev thi app base marketplac connect healthcar facil healthcar profession allow healthcar profession book demand shift healthcar facil access demand talent mission enabl healthcar profession work want enabl healthcar facil meet talent need clipboard health clipboard health post seri c extrem fast grow tech startup classic two side network effect revolution market healthcar talent diver inclus compani global remot team name one yc top compani two year run grown 25x across key metric last 18 month ha never excit time join grow team help u serv even healthcar profession healthcar facil better serv patient learn cultur clipboard health take look cultur hub n n n nabout role n nwe look custom centric individu servic marketplac empathi judgment custom issu provid best solut servic move fast possibl go way make sure custom taken care exhibit highest standard custom servic custom first point contact problem solver solut driven think foot take initi know escal situat work independ thrive fast pace environ n nour custom base sole within unit state thi time servic nurs workplac use marketplac 24 7 n n n nday day respons n nprocess custom contact deliv prompt solut phone chat emailcommun collabor differ departmentsinvestig research resolv custom issueshandl tough dissatisfi custom polit professionallytrack follow custom request time mannermanag conflict prioritiesprovid outstand except custom servicemust weekend avail n nwhat set apart n nyou quick think foot commun clearli ea handl difficult situat custom alway respond empathi genuin curiou take initi solv problem see n n n nwhi work cbh n nbe part fast pace startup unicorn make huge differ live ten thousand custom work home occasion opportun meet cowork includ travel around world person person profession develop opportun interest develop particular skill learn particular part busi give opportun learn n nsystem requir chromebook linux n nminimum 20mbp wire internet connectioncpu minimum quad core cpu intel core i5 8th gen higher amd ryzen 5 2000 seri higher ram minimum 16gb higherboot drive use ssdwire headsetquiet work environmentsteadi power internet n nwe oper 24 7 work rotat roster includ weekend 
949514,Talent Scientist,"Less than 300,000",IT & Telecoms,4,"As a Talent Scientist, you will work closely with these Hiring Leads to drive initiatives, automation and best practice whilst offering an expert viewpoint on talent assessments.",pioneer remot first tech compani product inspir peopl global attract huge number applic organis creat hire process total uniqu empow hire leadership team lead talent select talent scienc team ensur process effect busi abl make best decis select except talent thi except opportun join team chang way organis hire n n n nour talent scienc team ha mission ensur follow object scientif rigor effici process select veri best new colleagu regardless locat cultur background work close key stakehold ensur decis made right way hire model support section world class talent regardless locat cultur background n n n n talent scientist work close hire lead drive initi autom best practic whilst offer expert viewpoint talent ass thi recruit posit scienc talent perform rais awar insight across busi make compani outstand choic select process n n n nwe number entri mid level open team seek follow n na passion involv organis think hire talenta bachelor master degre psycholog except academ track record abil interview candid use behaviour interview techniqu compet base psychometr ass except analyt problem solv abil experi use statist analysi identifi behaviour patternsa high level person organis work remot effect n nwe number open role team rang junior mid level role base remot emea region n nlocat emea home base n n n nwhat day look like n na talent scientist n ndrive talent analyt provid busi real time insight partner busi help move hire process effici conduct depth behaviour talent interview provid consider insight motiv behaviour build key relationship global stakehold ensur deliv hire agenda close monitor hire activ drive result ensur consist oper processesdr data driven insight make sure decis make process robust support inform decis consid employ brand interact candid impact experi review streamlin hire process tool drive continu improv work extern third parti platform ensur maximis return invest bring passion diver inclus ensur remov unconsci bia hire process ensur sourc strategi underpin thi n nwhat look n nan undergradu postgradu degre psycholog industri psycholog compel narr altern chosen path togeth except academ track record throughout educ year great analyt skill run statist analysi hire data use metric fuel decis make influenc posit chang exposur appreci psychometr ass includ interpret valid reliabl metricsan demonstr viewpoint talent deep appreci predict measur success peopl experi conduct behaviour compet base interview abil train stakehold advis get best interview success track record scope deliv project excel verbal written english willing travel compani event 2 4 time year two week n nother skill may bring n nexperi statist signific test experi bayesian infer predict analyt ml python r sql experi build data dashboard exposur follow tool linkedin talent insight greenhous disc profil n nwhat offer n nwe consid geograph locat experi perform shape compens worldwid revisit compens annual often graduat associ ensur recognis outstand perform addit base pay offer perform driven annual bonu provid team member addit benefit reflect valu ideal balanc program meet local need ensur fair global n ndistribut work environ twice yearli team sprint personperson learn develop budget usd 2 000 per yearannu compens reviewrecognit rewardsannu holiday leavematern patern leaveemploye assist programmeopportun travel new locat meet colleaguesprior pas travel upgrad long haul compani event n nabout canon n ncanon pioneer tech firm forefront global move open sourc compani publish ubuntu one import open sourc project platform ai iot cloud chang world daili basi recruit global basi set veri high standard peopl join compani expect excel order succeed need best canon ha remot first compani sinc incept 2004 work step futur challeng think differ work smarter learn new skill rais game n ncanon equal opportun employ n n n nwe proud foster workplac free discrimin diver experi perspect background creat better work environ better product whatev ident give applic fair consider n n li remot 
949513,Graduate Customer Success Manager,"Less than 300,000",IT & Telecoms,4,"This role is a first step in the CSM organisation. Primarily focusing on the Tech segment, including the store customers, you will also have a the portfolio assigned. Ubuntu is chosen by thousands of new users every month.",role graduat custom success manag canon n ncustom success new strateg depart canon clear object reduc risk churn facilit adopt new product servic support expans within exist account custom success manag csm respons develop trust assign custom commit provid best possibl experi navig canon vast offer clear understand custom object csm activ larg rang intern extern capabl allevi ani pain point align expect well help draw deliv appropri collabor roadmap n n n nwe grow custom success team continu offer thought smart precis interact across product portfolio ubuntu open sourc infrastructur applic n nthi role first step csm organis primarili focus tech segment includ store custom also portfolio assign ubuntu chosen thousand new user everi month thi respons ensur best user experi problem solv onboard enabl valu realis way success collabor problem solv particip campaign effort connect larg rang user canon product identifi futur champion n nlocat thi role base remot worldwid n n n nwhat day look like n na strong focu support custom find solut ticket request enrich document problem solv q amp onboard materi drive campaign target multipl custom digit touch point activ identifi high potenti well high risk custom newli onboard user customersonboard new custom introduc product support process product includ ubuntu pro maa landscap openstack ceph kubernet data applic mani collabor sale support develop deliv engag plan fulfil custom object engag portfolio custom ensur risk identificationcollect feedback custom format review product team n n n nwhat look n ncustom face experiencean empathet individu natur drive help otherspass technolog infrastructur ubuntu particular mustexcel present skillsstrong organis skill abil structur constantli updat documentationa team player capabl interact depart intern n n n naddit skill might also bring n nfluenci languag english n n n nwhat offer n nwe consid geograph locat experi perform shape compens worldwid revisit compens annual often graduat associ ensur recognis outstand perform addit base pay offer perform driven annual bonu provid team member addit benefit reflect valu ideal balanc program meet local need ensur fair global n ndistribut work environ twice yearli team sprint person work remot sinc 2004 person learn develop budget usd 2 000 per yearannu compens reviewrecognit rewardsannu holiday leavematern patern leaveemploye assist programmeopportun travel new locat meet colleagu team othersprior pas travel travel upgrad long haul compani event n n n nabout canon n ncanon pioneer tech firm forefront global move open sourc compani publish ubuntu one import open sourc project platform ai iot cloud chang world daili basi recruit global basi set veri high standard peopl join compani expect excel order succeed need best n ncanon ha remot first compani sinc incept 2004 work canon step futur challeng think differ work smarter learn new skill rais game canon provid uniqu window world 21st centuri digit busi n n n ncanon equal opportun employ n nwe proud foster workplac free discrimin diver experi perspect background creat better work environ better product whatev ident give applic fair consider 
949512,Talent Acquisition Partner (Tech & Business),"Less than 300,000",IT & Telecoms,4,"As Talent Acquisition Partner you are in charge of finding and retaining top-notch talent around the globe for Appinio by providing the best possible candidate experience. The Appinio team is our very core success factor and our biggest USP - by growing this group, you will have an enormous impact on our company’s success.",allow u introduc ourselveshello appinio fastest coolest market research platform mission make world littl fact base help compani understand consum think make better data driven decis start hamburg back 2014 humbl call world playground 200 employe spread across 25 citi remot first 2000 intern client panel reach 7 million global want part appinio movement n nyour mission talent acquisit partner tech busi look passion driven talent acquisit partner join talent acquisit team support intern growth appinio talent acquisit partner charg find retain top notch talent around globe appinio provid best possibl candid experi appinio team veri core success factor biggest usp grow thi group enorm impact compani success essenti point contact candid well trust partner hire manag doingcontribut develop implement strategi attract hire high qualiti candid focu technic roleshandl end end recruit process includ draft job descript manag job post track candid progress collabor hire manag understand job requir qualif team dynam open posit screen resum conduct initi screen ass candid qualif experi cultur fit sourc candid variou channel includ job board social medium profession networkstak lead offer negoti includ prepar pitch compens packag benefit candid stay updat market trend recruit best practic emerg tool technolog contribut innov idea continu improv enhanc employ brand ensur outstand end end candid experi stage recruit processy thrive thi role ifyou degre human resourc busi administr psycholog relat fieldyou least 2 year work experi recruit high volum candid daili ideal start fast pace environmentsy experi technic recruit ideal busi well curiou learn profici applic track system greenhous prefer hr technolog toolsyou strong activ sourc skillsyou abl make inform hire recommend look relev datay fluent englishy excel written verbal commun skillsyou adapt quickli chang prioriti busi need evolv recruit strategiesy bring strong interperson skill build posit work relationship contribut collabor team environmenty proactiv attitud toward learn stay updat industri trend best practic emerg technolog talent acquisit flexibl polici mean hard cap number vacat dayswork anywher polici chanc develop amaz product one countri oper spain franc germani portug netherland uk chanc work outsid countri resid maximum 180 day per year given valid work permit countryudemi l amp platform full access 22 000 cours certif deepen knowledg career progressesal hardwar need macbookin case locat hamburg berlin get deutschlandticket access mobil budget ryde app get offic spacein case locat hamburg get access beauti offic hamburg citi center terrac bbq includ case locat germani spain access subsid urban sport club membershipin case locat berlin access co work space get togeth fellow appinion n n 
949511,Senior Product Designer,"Less than 300,000",IT & Telecoms,4,"You’ll learn quickly, dive deep into our business, and bring your human-centered lens to opportunities big and small across the team.",whi clipboard health exist exist lift mani peopl socioeconom ladder possibl dramat improv live let healthcar profession turn extra time ambit career growth financi opportun achiev thi app base marketplac connect healthcar facil healthcar profession allow healthcar profession book demand shift healthcar facil access demand talent mission enabl healthcar profession work want enabl healthcar facil meet talent need clipboard health clipboard health post seri c extrem fast grow tech startup classic two side network effect revolution market healthcar talent diver inclus compani global remot team name one yc top compani two year run grown 25x across key metric last 18 month ha never excit time join grow team help u serv even healthcar profession healthcar facil better serv patient learn cultur clipboard health take look cultur hub n n n nabout role n nyou join one found member design team set rais bar overal qualiti coher mean product servic creat world team work within fast grow quickli move complex marketplac organ design exist clipboard heath solv creat valu around human focus problem trust engag clariti safeti big theme grappl n n n nyou lead space help set rais bar design clipboard health thi drive clear thought action orient design process partner across team defin deliv high qualiti custom experi ux servic product design lens innov big part clipboard design work root deepli understand custom user need outcom context n n n nyou learn quickli dive deep busi bring human center len opportun big small across team thi role sit within product team read follow doc team prior appli product team standard product team recruit product team structur document give sen think valu also link team compani cultur candid websit n n n nrespons n nconduct depth user research translat learn action insightsbrainstorm broadli ambiti welcom half bake idea idea push envelop interact visual design product work creat intuit delight experi customersdepend product may also brand imag messagingpartn product manag engin disciplin priorit n nqualif n n2 year work experi product design graduat degre design relat fieldexpertis design tool figma particular relev profession experi startup marketplac prefer 
949509,Global Revenue Operations Manager,"Less than 300,000",IT & Telecoms,4,"As a Revenue Operations Manager you will partner with Canonical’s executive team across sales, business development, customer success, marketing, product management, commercial systems, delivery, finance and legal and provide a focal point to drive improvements. This position requires an analytical approach, a keen eye for detail and the ability to drive process and system improvement.",canon ha open two manag posit except revenu oper leader grow global direct allianc channel partner onlin sale revenu oper team analys drive intervent maximis net custom retent lead robust repeat process plan manag deliv revenu n n n na revenu oper manag partner canon execut team across sale busi develop custom success market product manag commerci system deliveri financ legal provid focal point drive improv thi posit requir analyt approach keen eye detail abil drive process system improv n n n nlocat role held remot emea america time zone n n n nwhat day look like n ndeliv precis scalabl revenu oper busi direct indirect onlin channel n noverse sale technolog process drive autom process improv n ndrive sale engag train enabl data enrich custom relationship manag configur price quot analyt commiss n npartner commerci system engin team continu improv busi system integr n nlead introduct new product price packag bundl system easi sale navig quot n nlead enhanc commerci review process evalu steer sale opportun n ndrive data qualiti order process new hire train process document report data clean n nown commiss plan lead process set goal evalu pay plan n ninstrument measur improv process across entir revenu oper spectrum n ndeliv metric report monitor improv revenu oper effect includ new lead pipelin veloc sale product renew use thi data drive insight manag territori agre implement action chang execut manag regular sale busi review n n n nwhat look n nan except academ track record high school univers n nundergradu degre relat field compel narr altern path n ndrive track record go abov beyond expect n nexperi oper senior leadership role ideal within similar technolog subscript base busi n ntrack record provid insight robust technolog platform data analyt compens system process deliv excel revenu oper n ndeep understand work global multicultur organis includ manag team direct report remot differ time zone n na thought systemat approach skill measur identifi deliv system process ensur repeat scalabl outcom n ncomfort commerci pressur abil put revenu team appropri perform pressur n norganis skill abil interact work stakehold within level organis n ncommun negoti skill achiev buy prioriti key stakehold n nfluent busi english written spoken n nwilling travel intern 4 time year compani event n n n nwhat offer n nwe consid geograph locat experi perform shape compens worldwid revisit compens annual often graduat associ ensur recognis outstand perform addit base pay offer perform driven annual bonu provid team member addit benefit reflect valu ideal balanc program meet local need ensur fair global n n n ndistribut work environ twice yearli team sprint person n nperson learn develop budget usd 2 000 per year n nannual compens review n nrecognit reward n nannual holiday leav n nmatern patern leav n nemploye assist programm n nopportun travel new locat meet colleagu n nprioriti pas travel upgrad long haul compani event n n n nabout canon n ncanon pioneer tech firm forefront global move open sourc compani publish ubuntu one import open sourc project platform ai iot cloud chang world daili basi recruit global basi set veri high standard peopl join compani expect excel order succeed need best canon ha remot first compani sinc incept 2004 work step futur challeng think differ work smarter learn new skill rais game 
